{
  "schemaVersion": 1,
  "tournamentRef": "trn_01k4f6y7m8n9p0q1r2s3t4v5wx",
  "view": "standings",
  "language": "auto",
  "group": "grp_01k4f70bcde2fgh3jkm4npq5rs",
  "participant": null,
  "matchFrom": null,
  "matchTo": null,
  "dateFrom": null,
  "dateTo": null,
  "theme": "auto",
  "density": "comfortable",
  "accentColor": null,
  "showBranding": true,
  "openLinksInNewTab": true,
  "minHeight": 240,
  "maxHeight": 4000,
  "showTeamLogos": true,
  "showPlayed": true,
  "showWinsDrawsLosses": true,
  "showScoreBalance": true,
  "showPoints": true,
  "enableGroupNavigation": true,
  "showMatchNumber": true,
  "showDate": "auto",
  "showTime": true,
  "showField": true,
  "showGroup": true,
  "showRound": true,
  "showReferee": true,
  "showLiveState": true,
  "showExtraTime": true,
  "showPenaltyResult": true
}
