{
  "schemaVersion": 1,
  "tournamentRef": "trn_01k4f6y7m8n9p0q1r2s3t4v5wx",
  "view": "matches",
  "language": "de",
  "group": "grp_01k4f70bcde2fgh3jkm4npq5rs",
  "participant": "ptc_01k4f71bcde2fgh3jkm4npq5rs",
  "matchFrom": 4,
  "matchTo": 12,
  "dateFrom": "2026-09-12",
  "dateTo": "2026-09-13",
  "theme": "dark",
  "density": "compact",
  "accentColor": "#16A34A",
  "showBranding": true,
  "openLinksInNewTab": true,
  "minHeight": 320,
  "maxHeight": 4000,
  "showTeamLogos": true,
  "showPlayed": true,
  "showWinsDrawsLosses": true,
  "showScoreBalance": true,
  "showPoints": true,
  "enableGroupNavigation": true,
  "showMatchNumber": true,
  "showDate": "show",
  "showTime": true,
  "showField": true,
  "showGroup": true,
  "showRound": true,
  "showReferee": false,
  "showLiveState": true,
  "showExtraTime": true,
  "showPenaltyResult": true
}
